alt,caption,dimensionsHeight,dimensionsWidth,displayUrl,locationId,location Name,owner Full Name,owner Username,timestamp
"Photo by Creative Multimedia Club (CMC) on May 10, 2025. May be an illustration of poster, magazine and text that says ""MMMU LTINCDIAUMIVE THEAIRICAIPERFORMANCE HEATRICAI TRICAL PERFORMANCE RUMAH KOSONG 15-17 MAY 2025 8.30 NICI FCM Gallery, Faculty Creative Multimedia, MMU, Cyberjaya 010 ...... Imbas QR untuk ticket TICKETPRICE RM50 RM 50 ADULT RM RM30 30 STUDEN RM 100 1ΕO GROUP GROUPİSTJDENTI ISTUDENTI DATO SERI DATOYSERIDR.JA.SAMADSAD IDR.JA A SAMAD SAID IRYAN IDA MUI IRYANDAMULIARAMLY A RAML NFOATCKET 0133117625(Ela) 013 7625 (Ela) Cmmy MULTIMEDIA TMCROU CROLP"".","The ‘Rumah Kosong’ theatre is one of the highlights of Apresiasi A.Samad Said 2025 program. ⭐️

Organised by @pertubuhan_seninusantara together with @creativemmu, @mmumalaysia, Crisscut Design and @manggis.group, this program aims to honour the works and legacy of National Laureate Dato’ (Dr) A. Samad Said through digital, interactive, and contemporary approaches.

🗓️15-17 May 2025
📍FCM Gallery, Faculty of Creative Multimedia, Multimedia University, Cyberjaya

Any enquires please contact:
Bhuvanesh Rao (Director)
016-2587025
Creative Multimedia Club

#AS2025XCMC #AS2025 #asamadsaid #fcmmmu #mmucyberjaya #thereisuinmmu #creativemmu #creativemultimediaclub #cmc #immersiveart #theatrical",1350,1080,https://scontent-man2-1.cdninstagram.com/v/t51.2885-15/497558113_18369209929123518_2083788943807964801_n.jpg?stp=dst-jpg_e35_p1080x1080_sh0.08_tt6&_nc_ht=scontent-man2-1.cdninstagram.com&_nc_cat=106&_nc_oc=Q6cZ2QEqKr4Cmvd9HOXVDum58OeDjfynwGDafJIEUgrYY5tuETvmyk4YDAyrb4tA8Y2ln7c&_nc_ohc=WZlp-8K-CewQ7kNvwHEkLHk&_nc_gid=P9dnY687CEIFeH4HgCZEKg&edm=APs17CUBAAAA&ccb=7-5&oh=00_AfKTRr7X6DOowpkZA1oZuFATnghgmmkwtNIRsLCOTcCJZw&oe=68276462&_nc_sid=10d13b,,,Creative Multimedia Club (CMC),cmcmmu,2025-05-11T03:42:49.000Z
"Photo by Creative Multimedia Club (CMC) on May 10, 2025. Pode ser uma ilustração de 1 pessoa, pôster, revista e texto que diz """"MMU® MULTIMEDIA UNIV VERSITY APPRECIATING A.SAMAD SAID 2025 AN EXPLORATION OF THE INTERPRETIVE WORKS FROM THE COMPETITION, DARI KATA E KANVAS GALERI DUNIA A. SAMAD SAID 15- 27 MAY 2025 'RUMAH KOSONG' THEATRE PERFORMANCE 15 15-17 17 MAY 2025 WRITTEN BY ALAYSIAN NATIONAL LAUREATE DATO' SERI (DR.) SAMAD SAID ADAPTED: DIRECTED IRYANDA MULIA RAMLY LOCATION: FCM GALLERY FACULTYO CREATIVE MULTIMEDIA MULTIMEDIA UNIVERSITY, OMMU PRESICS-NESE CREATIVE MULTIMEDIA TM GROUP"".","Mark your dates for some fun activities and cool exhibitions in appreciation of Dato’ Seri (Dr.) A. Samad Said! 🤩 Swipe to see what’s happening ➡️

Date:
🗓️Exhibition: 15-27 May 2025
🎭 Theatre Performance ‘Rumah Kosong’: 15-17 May 2025
📍FCM Atrium & FCM Gallery, Faculty of Creative Multimedia, Multimedia University, Cyberjaya 

Any enquires please contact:
Bhuvanesh Rao (Director)
016-2587025
Creative Multimedia Club

#AS2025XCMC #AS2025 #asamadsaid #fcmmmu #mmucyberjaya #thereisuinmmu #creativemmu #creativemultimediaclub #cmc #immersiveart #theatrical",1350,1080,https://instagram.fthe14-1.fna.fbcdn.net/v/t51.2885-15/496963429_18369207988123518_123688420542741271_n.jpg?stp=dst-jpg_e35_p1080x1080_sh0.08_tt6&_nc_ht=instagram.fthe14-1.fna.fbcdn.net&_nc_cat=106&_nc_oc=Q6cZ2QEqqJFjGToQAwN1dP7dQ61zBlQgTvwVHJj_VeqkmcrsJPI90xEiE0fgeieXEan_ptg&_nc_ohc=a3oLu9ICmhsQ7kNvwGAKQo7&_nc_gid=wGSzf-9fV78cJ7TGlQ1UKQ&edm=APs17CUBAAAA&ccb=7-5&oh=00_AfJJ9U5Um50BPvpdlTevWGTEZWOg5VaM6oZN2jbifsfpBA&oe=68274BFD&_nc_sid=10d13b,,,Creative Multimedia Club (CMC),cmcmmu,2025-05-11T03:17:35.000Z
"Photo shared by Creative Multimedia Club (CMC) on April 13, 2025 tagging @srcmmu_cyber, and @csrwmmu_cyber. May be pop art of poster, water bottle, magazine and text.","Swing by Booth 12 @ Plaza Central this 14–15 April, 9AM–6PM and discover what Creative Multimedia Club (CMC) is all about!

Join Creative Multimedia Club (CMC) and enjoy:

1. Hands-on design workshops
2. Leadership skill glow-up
3. Meet your fellow creative besties
4. Get your work seen through our platform

Come vibe with us😾🤘🏻tap on the link in our bio for member registration🔗",1350,1080,https://scontent-atl3-1.cdninstagram.com/v/t51.2885-15/489817950_18365943610123518_4383919346996515348_n.jpg?stp=dst-jpg_e35_p1080x1080_sh0.08_tt6&_nc_ht=scontent-atl3-1.cdninstagram.com&_nc_cat=106&_nc_oc=Q6cZ2QF3VMUwcvbSHUHdcfO-Y3YkZOVef2I0dM73M2CixXvFwLKoY07SdrqWjY9QqQ9r-s0&_nc_ohc=V8_dFLx8yrIQ7kNvwF6M_al&_nc_gid=3MQojDImRfXy_k7qE7H3bg&edm=APs17CUBAAAA&ccb=7-5&oh=00_AfJNOO1CAPhihtlTJncIORVTbtdDkQIk9g_-WxbsbQdSnA&oe=6827606E&_nc_sid=10d13b,,,Creative Multimedia Club (CMC),cmcmmu,2025-04-14T05:05:09.000Z
,"Selamat Hari Raya !🌙✨May your raya be as sweet as dodol and as bright as pelita!

#Eidmubarak #cmcmmu #fcmmmu",937,750,https://scontent-sjc3-1.cdninstagram.com/v/t51.2885-15/488217273_18363778048123518_2947449449415907832_n.jpg?stp=dst-jpg_e15_tt6&_nc_ht=scontent-sjc3-1.cdninstagram.com&_nc_cat=106&_nc_oc=Q6cZ2QErMTCpYt3QtMTzbcCM3a2ejUq-9gNqtz6IIfIXq64mtrHtQPC9wHSekxxOx6PL6zw&_nc_ohc=Q1IImnWI8Z4Q7kNvwGQTYhH&_nc_gid=wStndhXhCrsHmkZL2Iv_Lg&edm=APs17CUBAAAA&ccb=7-5&oh=00_AfJ14ZL-7qwl-cn7dxM4Ga_PWEBQ27X8OPXm3cVSqthE_Q&oe=6827720D&_nc_sid=10d13b,,,Creative Multimedia Club (CMC),cmcmmu,2025-03-31T01:06:04.000Z
"Photo by Bursa Young Investor Club on April 13, 2025. May be an image of poster and text that says 'DMMU MULTIMEDIAONIVERSITY ULTIMEDIA NIVERSITY SYAM 三 BYIC CSRW BURSA YOUNG INV ESTOR CLUB 14 14&15APRIL 15 APRIL 9 9 AM 4 PM Step into the financial jungle discover, learn, and grow with BYIC!'.","Step into the Jungle of Finance!
Join us this 14 & 15 April from 9 AM - 4 PM for CSR Week and explore the wild world of investing with the Bursa Young Investor Club (BYIC)!

Scan the QR code to sign up — membership is only RM5!
Whether you’re a curious cub or a savvy lion, there’s something for everyone to discover.

Let’s grow together — financially and as a community!
#BYICMMU #CSRWeek2025 #FinancialJungle #JoinTheClub #MMUCyberjaya #StudentLife #InvestSmart",1080,1080,https://scontent-dfw5-1.cdninstagram.com/v/t51.2885-15/491903155_18040975766626109_8769034308086085494_n.jpg?stp=dst-jpg_e15_fr_s1080x1080_tt6&_nc_ht=scontent-dfw5-1.cdninstagram.com&_nc_cat=105&_nc_oc=Q6cZ2QFQO6Rmo-_N3L8dwVtx3TVGPyrBO85MyOJsagYyooNiqSzfOd8_I1WSEmy6hA2NSlA&_nc_ohc=Nuv3LIrb5pMQ7kNvwEe8wN8&_nc_gid=wg-c0lxNE8xMiNi1eIwXtw&edm=APs17CUBAAAA&ccb=7-5&oh=00_AfITL3Us2j1bMd6pRrhV6hmf4Ki3A9HA9cUDeQm6AnqZqQ&oe=68276188&_nc_sid=10d13b,,,Bursa Young Investor Club,byic.mmu,2025-04-14T02:47:29.000Z
"Photo by Bursa Young Investor Club on March 15, 2025. May be an image of 4 people, people studying, screen, bureau, newsroom, office and text.","""Officially started my trading journey with Affin Hwang Bank! ""

Excited to explore new investment opportunities, learn the market, and make strategic moves. Here's to a future of smart investing and financial growth! 

#AffinHwang #StockMarket #TradingJourney #InvestSmart",1080,1080,https://instagram.fagc3-2.fna.fbcdn.net/v/t51.2885-15/484640738_18037615919626109_2441599967638565368_n.webp?stp=dst-jpg_e35_s1080x1080_sh0.08_tt6&_nc_ht=instagram.fagc3-2.fna.fbcdn.net&_nc_cat=105&_nc_oc=Q6cZ2QElZuNavo_FVRmJHlROl05BDcxDoiNRmhLKyeoxjjo64lfHIOYUe8dhWm_i1foxYVUDcoLulXWyhlfxy8QmDQLR&_nc_ohc=zxeXRHOUG7oQ7kNvwH4Bfck&_nc_gid=ZhoK6Oe98ITsJZ2rE4xL3A&edm=APs17CUBAAAA&ccb=7-5&oh=00_AfJdFPctKoz2BlB7UeJlZVLRdLK-pyn4UpiheYfEjduSFA&oe=6827664A&_nc_sid=10d13b,,,Bursa Young Investor Club,byic.mmu,2025-03-15T14:57:32.000Z
"Photo by Creative Multimedia Club (CMC) on March 15, 2025. May be an image of computer keyboard, crossword puzzle and text that says 'Come join us! don't esc 賞'.","Join a community that supports you, brings people together, and sparks creativity through fun activities.

Sign up now and be part of something amazing 👾💥!
#cmcmmu #fcmmmu #creativemultimediaclub",1350,1080,https://instagram.fkin1-1.fna.fbcdn.net/v/t51.2885-15/485066019_18361430560123518_3930668776839561150_n.jpg?stp=dst-jpg_e35_p1080x1080_sh0.08_tt6&_nc_ht=instagram.fkin1-1.fna.fbcdn.net&_nc_cat=106&_nc_oc=Q6cZ2QEeVorNqwk0QltFaAKEQB5fV445t0ol59AS8tRicXsnsDH7Yy_VfoCuxwga3gZR9RQ&_nc_ohc=Z7Y8PxUihd4Q7kNvwHg1AmH&_nc_gid=emzB5i26apVdQgtkslyIYA&edm=APs17CUBAAAA&ccb=7-5&oh=00_AfITRkFYhuGMRSFJ-HUrQzcJViNwYq1IWdBMRG28gH9kdw&oe=682744BC&_nc_sid=10d13b,,,Creative Multimedia Club (CMC),cmcmmu,2025-03-15T22:21:50.000Z
"Photo by Bursa Young Investor Club on March 15, 2025. May be an image of 6 people and text that says 'ம CIAL FREEDOM N PUI FUNG'.","""That’s a wrap on 'Think Rich, Play Smart'! ""💡💰 

A big thank you to everyone who joined us on Jan 9, 2025, for an enriching session on wealth and financial literacy. From smart investment strategies to financial planning, we explored key insights to build a secure and prosperous future. 🌟 

Stay tuned for more empowering events!

#ThinkRichPlaySmart #FinancialLiteracy #WealthBuilding #LFPSolutionConsultancy""",720,1080,https://scontent-jnb2-1.cdninstagram.com/v/t51.2885-15/484815321_18037619819626109_2247593237038745618_n.webp?stp=dst-jpg_e35_s1080x1080_sh0.08_tt6&_nc_ht=scontent-jnb2-1.cdninstagram.com&_nc_cat=105&_nc_oc=Q6cZ2QFH2MJEM84yj4sxKHT71_L2Sei0hfsV4K6U6u1LVNyI0QEz73l2i220HWFTN5bousk&_nc_ohc=y8jpHc51QAsQ7kNvwEf4Rqu&_nc_gid=NosE0E3qp40rTAkDBIpSMA&edm=APs17CUBAAAA&ccb=7-5&oh=00_AfLWq0tZkIaE22bt_F_1jYBCTDL6T6haZPjxpd5_QZ7vUw&oe=6827454C&_nc_sid=10d13b,,,Bursa Young Investor Club,byic.mmu,2025-03-15T15:25:03.000Z
"Photo by Bursa Young Investor Club on March 15, 2025. May be an image of printer, screen, banner, office and text.","""That's a wrap on Finworld's Intro to Stock Trading workshop! 🚀""

A huge thank you to everyone who joined us on Dec 5, 2025—we covered market fundamentals, trading strategies, and how to make informed investment decisions. 📈💡 

Stay tuned for more sessions to level up your financial game!

 #Finworld #StockTrading #InvestSmart",1080,1080,https://scontent-iad3-2.cdninstagram.com/v/t51.2885-15/484298979_18037618544626109_4493569245828141594_n.webp?stp=dst-jpg_e35_s1080x1080_sh0.08_tt6&_nc_ht=scontent-iad3-2.cdninstagram.com&_nc_cat=105&_nc_oc=Q6cZ2QEonc2yngip1B1CJPKxtIQXvGNB12gu4eKGpJmDX3z6rSVaRfX4wFD8dcObTDscdd4&_nc_ohc=CBlX6VdBLfoQ7kNvwFjcv_u&_nc_gid=5buN5_ZyeSp2-yPPsN0gOw&edm=APs17CUBAAAA&ccb=7-5&oh=00_AfL7Dx1TddHNOUsZbWCWKlj8oi-TtdMCABsDL_T9gsqleA&oe=68275396&_nc_sid=10d13b,,,Bursa Young Investor Club,byic.mmu,2025-03-15T15:09:39.000Z
,"“That’s a wrap on ‘Think Rich, Play Smart’! “💡💰 

A big thank you to everyone who joined us on Jan 9, 2025, for an enriching session on wealth and financial literacy. From smart investment strategies to financial planning, we explored key insights to build a secure and prosperous future. 🌟 

Stay tuned for more empowering events!

#ThinkRichPlaySmart #FinancialLiteracy #WealthBuilding #LFPSolutionConsultancy”",360,640,https://scontent-ord5-3.cdninstagram.com/v/t51.2885-15/485077743_1637659603541970_3363733244984772523_n.jpg?stp=dst-jpg_e15_tt6&_nc_ht=scontent-ord5-3.cdninstagram.com&_nc_cat=106&_nc_oc=Q6cZ2QG44p6qmVetzuy03ebIbc7Qd_VjSU6nKJS4nDP7SFYx05uykXB_1GZoKz1S4hyANo5QnthsLCKe_7AQnQTRi8ZN&_nc_ohc=Br4hr4GLJUIQ7kNvwHHwDtA&_nc_gid=MZJxfBiXmc221mp4nNDAbA&edm=APs17CUBAAAA&ccb=7-5&oh=00_AfKACJwNfRdiRMEOfmlh-8XIMD7lbgBrV9E6fQW2Jo41Uw&oe=68275BD6&_nc_sid=10d13b,668389676,Multimedia University,Bursa Young Investor Club,byic.mmu,2025-03-19T21:45:59.000Z
"Photo shared by Once Upon a Stage on May 08, 2025 tagging @tamucyb, @rentakmmu, @ebeevocals, and @shsommu. May be an illustration of ‎owl, poster and ‎text that says '‎MMU UNIVERSIT MULTIMEDIAUNIVERSIT NIVER สร่าย Once OueeUpon Upon لأمر A Sitage arly ird 1stJune20257.30pmt011pm 1st June 2025 30pm to 11pm Dewan Tun Canse DewanTunCanselor, lor, Multimedia University (), Cyberjaya TMGROUP TM GROUP‎'‎‎.","A lil birdie told me... Belle’s booked her seat, and darling🌹You won’t want to miss this tale as old as time📜

Details on the tickets 🎫:
Early Bird - RM 30 (𝐒𝐎𝐋𝐃 𝐎𝐔𝐓)
Standard - RM 35 
Bundle (10 tickets) - RM 32/pax

✨and it's 𝐅𝐑𝐄𝐄 𝐒𝐄𝐀𝐓𝐈𝐍𝐆 for the show🪄

Grab your tickets NOW to know the full story on this fairytale🧚🏻

*prices shown are excluding RM2 ticketing processing fee*

#onceuponastage #performingarts #mmu",1350,1080,https://scontent-ord5-2.cdninstagram.com/v/t51.29350-15/496635489_1222859835902909_3273344423637116250_n.heic?stp=dst-jpg_e35_p1080x1080_tt6&_nc_ht=scontent-ord5-2.cdninstagram.com&_nc_cat=105&_nc_oc=Q6cZ2QFNnwUUcPLGMmf9LIDo-o4EKTuS-WkI-SVST95WwhdXghlVaB_rICWDkdA5BYN8wROXeNV1vR7wEfdaMBfd7bXa&_nc_ohc=hTuTXTmo_78Q7kNvwGoEN62&_nc_gid=f1eomLPOnPTZLYMwJCbnUQ&edm=APs17CUBAAAA&ccb=7-5&oh=00_AfJDtdljI8iQWxDAHUk6yRjqrltIN-fb_5R2hHIgExaOEA&oe=68273F35&_nc_sid=10d13b,234736513,MMU Cyberjaya,Once Upon a Stage,onceuponastage.official,2025-05-08T08:02:50.000Z
"Photo shared by Once Upon a Stage on April 28, 2025 tagging @tamucyb, @rentakmmu, @ebeevocals, and @shsommu. May be a cartoon of poster and text that says 'OMMU MULTIMEDIAUNIVERSITY UNIVERSITY MULTIMEDIAL ตาว Once nUpon nce pon Stage Where Dreams Came rиe 4иe 4e 綠之刺 TM TMGROU GROUP'.","✨ 𝐎𝐧𝐜𝐞 𝐔𝐩𝐨𝐧 𝐀 𝐒𝐭𝐚𝐠𝐞: 𝐖𝐡𝐞𝐫𝐞 𝐃𝐫𝐞𝐚𝐦𝐬 𝐂𝐨𝐦𝐞 𝐓𝐫𝐮𝐞 ✨

Get ready to embrace the magic with us! 🌟

📅 Date: 𝟭𝘀𝘁 𝗝𝘂𝗻𝗲 𝟮𝟬𝟮𝟱 (𝗦𝘂𝗻𝗱𝗮𝘆)
🕖 Time: 𝟳:𝟯𝟬 𝗣𝗠 – 𝟭𝟭:𝟬𝟬 𝗣𝗠
📍 Venue: 𝗗𝗲𝘄𝗮𝗻 𝗧𝘂𝗻 𝗖𝗮𝗻𝘀𝗲𝗹𝗼𝗿, 𝗠𝘂𝗹𝘁𝗶𝗺𝗲𝗱𝗶𝗮 𝗨𝗻𝗶𝘃𝗲𝗿𝘀𝗶𝘁𝘆 (𝗠𝗠𝗨) 𝗖𝘆𝗯𝗲𝗿𝗷𝗮𝘆𝗮

An enchanting night awaits — don’t miss it! 🌟🏰 

#onceuponastage #mmu #embracethemagic #performingarts",1350,1080,https://scontent-iad3-1.cdninstagram.com/v/t51.29350-15/494082000_1326562111772782_3916393774772465831_n.heic?stp=dst-jpg_e35_p1080x1080_tt6&_nc_ht=scontent-iad3-1.cdninstagram.com&_nc_cat=110&_nc_oc=Q6cZ2QEr-Go-m1DgKbPsJ1WTmQrVZt_n3o1l7P2MgoMtDtYS2Jirlov0abFVi-sDZ_RjF1U&_nc_ohc=3imwZPtjzPgQ7kNvwFNgu96&_nc_gid=pptSHvzLjGQ7wVF0vjAuKA&edm=APs17CUBAAAA&ccb=7-5&oh=00_AfKcNQ_2k8myZVzsgTOdbXToK7oxht1wtAAfWmdQA-Hr3Q&oe=68276004&_nc_sid=10d13b,234736513,MMU Cyberjaya,Once Upon a Stage,onceuponastage.official,2025-04-28T08:45:25.000Z
,"Once upon a time, we dreamed of magical moments🪄...
And now, that dream might just come true✨

#OnceUponAStage #performingarts #magical",1137,640,https://scontent-atl3-1.cdninstagram.com/v/t51.2885-15/490120783_17842036038470539_8189622640123299782_n.jpg?stp=dst-jpg_e15_tt6&_nc_ht=scontent-atl3-1.cdninstagram.com&_nc_cat=107&_nc_oc=Q6cZ2QH0GCDZFAEzeJbEv_-QQ3PZHuPBa-KLEbK-v0exBFXKzBeM_G0e7i4r0gDEFZzXWnQ&_nc_ohc=ENllSYNWWvQQ7kNvwE4VZTe&_nc_gid=mrY4EPmhagwi4V3VW-cWVw&edm=APs17CUBAAAA&ccb=7-5&oh=00_AfJHX-PGNo92FHTlZ03qX0Vs2E3GrzpYBvPmMpSe86mqyQ&oe=68276F75&_nc_sid=10d13b,234736513,MMU Cyberjaya,Once Upon a Stage,onceuponastage.official,2025-04-13T08:15:05.000Z
"Photo by eBee Vocals on March 29, 2025. May be an image of 6 people, clarinet, trumpet, flute, oboe, poster and text.",,1350,1080,https://scontent-atl3-1.cdninstagram.com/v/t51.2885-15/487315410_17963581304883438_369967180654875802_n.jpg?stp=dst-jpg_e35_p1080x1080_sh0.08_tt6&_nc_ht=scontent-atl3-1.cdninstagram.com&_nc_cat=106&_nc_oc=Q6cZ2QFupmwhbGmK1SwBCareVu-o1R-6mtV3O3-aQANdZCxLQYIs8QboRhVIFuHVPK4Oda_W9wm791QWgak3vzUdWYWo&_nc_ohc=Iz2M5YJ0GesQ7kNvwEsWUAG&_nc_gid=z4NpThWokOhCCeeXT5N5mg&edm=APs17CUBAAAA&ccb=7-5&oh=00_AfK0e2bPWXSydH_f3dKi6zHFtLZcJ8MeEkgIXmYlAescfA&oe=6827400A&_nc_sid=10d13b,,,eBee Vocals,ebeevocals,2025-03-29T15:47:07.000Z
"Photo by eBee Vocals on March 29, 2025. May be an image of 6 people, poster, concert and text that says 'bee VOca 2024 E'.","‼️‼️ What’s up everyone ‼️‼️ 

Let‘s dive into a flavor explosion with sizzling street eats, sweet treats, and authentic Asian cravings you won’t want to miss! 

🔥 SAVORY HITS: Ayam Goreng Kunyit, Char Kuey Teow, Ramen, Takoyaki, Burger! 
🍨 SWEET VIBES: Apam Balik, Mango Shake, Ice Cream, Waffles, Desserts Galore! 

📆 13th–15th MAY 2025 
⏰ 8AM–11:30PM
📍 CENTRAL LECTURE COMPLEX

WHY WAIT?! Grab your squad, empty your stomachs, and let’s EAT, CHILL, REPEAT 🥢🍜✨#engsoc",1350,1080,https://instagram.fslz12-1.fna.fbcdn.net/v/t51.2885-15/487062855_17963581139883438_2193507361727078406_n.jpg?stp=dst-jpg_e35_p1080x1080_sh0.08_tt6&_nc_ht=instagram.fslz12-1.fna.fbcdn.net&_nc_cat=106&_nc_oc=Q6cZ2QFyLG7JK5XTpF3r0nmJWXat7ZytPotxWQdNJRYflD-QsuTdGlYSWYgDUNDlc1994Cw&_nc_ohc=yfgCyYRmhk0Q7kNvwFiXQCH&_nc_gid=SOjrS9sStFDhO7VwDNB4iQ&edm=APs17CUBAAAA&ccb=7-5&oh=00_AfIgRLiyYL5sbb_Z1gDST2LQdLg2tSzAxa5Wq8_rVfBlfQ&oe=68274260&_nc_sid=10d13b,,,eBee Vocals,ebeevocals,2025-03-29T15:46:48.000Z
"Photo by EngSoc MMU Cyberjaya on May 09, 2025. May be a graphic of chow mein, noodles, spaghetti and text.","‼️‼️What’s up Everyone ‼️‼️

We are beyond thrilled to announce regarding our bazaar for the upcoming week. From savoury street eats to sweet delights, explore a variety of authentic Asian dishes 🥘🍦🍴.

📆 13th–15th MAY 2025 
⏰ 8AM–11:30PM
📍 CENTRAL LECTURE COMPLEX

What are you guys waiting for!! Come join us !! 🎊🎊 #engsoc",1079,1080,https://scontent-lga3-3.cdninstagram.com/v/t51.2885-15/496869808_18038404925630956_8340946445367083137_n.jpg?stp=dst-jpg_e35_s1080x1080_sh0.08_tt6&_nc_ht=scontent-lga3-3.cdninstagram.com&_nc_cat=104&_nc_oc=Q6cZ2QHwZ6L4XNkXWgSmfS6Gn4GltUE_4khoX3uzHJaUw25gFGZm1M1kWZMZc-IKyNss6uU&_nc_ohc=XvXmcu-2H2AQ7kNvwHoxncn&_nc_gid=KYyNriDgxWOwmcvMwiJTJQ&edm=APs17CUBAAAA&ccb=7-5&oh=00_AfLdJxkoUl-bdFtz8rGcg6R7Y0fbVgTU3heAGkef2nm4ug&oe=68276CF0&_nc_sid=10d13b,,,EngSoc MMU Cyberjaya,engsoc_mmucyb,2025-05-10T06:02:58.000Z
"Photo by EngSoc MMU Cyberjaya on May 09, 2025. May be an image of poster, magazine and text that says 'Cybertron Baaar 小 地 Hurry up! a. Don't miss It FOOD BAZAAR. LOTS OF FUN 13-15 MAY 8AM 10.30PM FIND US INF FRONT OF TH HE SITI HASMAH DIGITALLIBRARY MMU CYBERJAYA'.","🌿 Throwback to the MUST Smart Farm Installation @ SMK Seri Permaisuri!
We brought smart farming to life—installing IoT systems, working with Arduino, and running hands-on STEM workshops for students! ⚙️🌱 It was all about real tech, real teamwork, and real impact.

🚀 Wanna be part of something awesome? Join the MMU Smart Technology Team (MUST) and unlock:
✨ Real-world tech exposure
🛠️ Hands-on skills (hardware, software & IoT!)
🤝 Leadership & teamwork experience
🌐 Mentorship & industry networking
📁 Portfolio & career boost

Let’s build the future—together!
#engsocmmu",1080,1080,https://scontent-lga3-3.cdninstagram.com/v/t51.2885-15/496818136_18038404946630956_4988655395586464467_n.jpg?stp=dst-jpg_e15_fr_s1080x1080_tt6&_nc_ht=scontent-lga3-3.cdninstagram.com&_nc_cat=104&_nc_oc=Q6cZ2QHUvGqSjadBdhGMYbZCB6M91_3CK0siZJzFd4Qx4d3U0jkjQjYCWxjtYYfyCIUd3rA&_nc_ohc=MgA1P3xSJHUQ7kNvwHJP3Id&_nc_gid=yHZ7OfGkoxu0YnwPQRFhCg&edm=APs17CUBAAAA&ccb=7-5&oh=00_AfLDBan1q2qGoW7p9oqOxCerYbc9f9_fzErqrMtf6QS_8A&oe=68273F7E&_nc_sid=10d13b,,,EngSoc MMU Cyberjaya,engsoc_mmucyb,2025-05-10T06:03:21.000Z
"Photo by EngSoc MMU Cyberjaya on April 17, 2025. May be a graphic of collard greens, poster, magazine, herb and text that says 'OMMU MUITIMEDI&UNIYERSITY NIVERSITY BENEFIT OF JOINING MUST Real-World Tech Exposure Skill Development Teamwork & Leadership Mentorship & Networking Portfolio & Career Boost LATESTPHOTOS LATEST'.","Cast your votes here: https://linktr.ee/D.I.C.E

🕰️ Community Vote Deadline: 30th April 2025

Forge Me is a character design competition hosted by DICE. After many weeks, 6 artists have submitted their work to gain a chance at winning prizes. 

The judges have casted their vote, but now it's up to the community. We'd love to hear from you. 

Take a look at the competitors' characters and stories. The winner will win the title of Community Favorite!",1080,1080,https://scontent-atl3-2.cdninstagram.com/v/t51.2885-15/491895384_18035945003630956_6986430086432031459_n.jpg?stp=dst-jpg_e35_s1080x1080_sh0.08_tt6&_nc_ht=scontent-atl3-2.cdninstagram.com&_nc_cat=104&_nc_oc=Q6cZ2QEmSj_1TJtvJ1L6iEkIdmc-vzCL_qcGBUWJUm3xsRdVqexQ7A6le0lEjsdfGk-sZpfWf8sHHlR8sthbtBZcu9XS&_nc_ohc=nq9X-Ne_v7AQ7kNvwF0nuWU&_nc_gid=2INl0zAKFEUhfdrGcOinhQ&edm=APs17CUBAAAA&ccb=7-5&oh=00_AfJr3jWodLKnbNo0w89nz9V_dO8GsBsG_yItr3yUJ_DV3A&oe=68274199&_nc_sid=10d13b,,,EngSoc MMU Cyberjaya,engsoc_mmucyb,2025-04-17T13:07:36.000Z
"Photo by Dive Into Imagination for Creative Entertainment on April 23, 2025. May be an image of sword, scarecrow, axe, poster and text.","Earlier during the semester break, we announced ⁣⁣
𝐅𝐎𝐑𝐆𝐄 𝐌𝐄 𝟐𝟎𝟐𝟓⁣⁣
A character design and story writing competition! ⁣⁣⁣⁣
This year's theme is ⁣⁣
𝐃𝐈𝐒𝐓𝐎𝐑𝐓𝐄𝐃 𝐕𝐀𝐋𝐔𝐄𝐒⁣⁣
⁣⁣
⁣⁣-----------------------------------------------------------⁣⁣
The judges have evaluated each submission by a scoring rubrics consisting of: ⁣⁣
> Visual Representation⁣⁣
> Background/Story⁣⁣
> Design Cohesion⁣⁣
> Creativity/Originality⁣⁣
> Theme⁣⁣
⁣⁣
Congratulations to: ⁣⁣
⁣⁣⁣⁣
𝐅𝐎𝐑𝐆𝐄 𝐌𝐄 𝐂𝐎𝐌𝐏𝐄𝐓𝐈𝐓𝐈𝐎𝐍 𝐖𝐈𝐍𝐍𝐄𝐑𝐒⁣⁣⁣
🥇 1st Place, RM75 : RORIK VHALIS by Qirana Qassandra⁣⁣⁣⁣
🥈 2nd Place, RM50 : ALEPH-0 by Nurul Iman⁣⁣⁣⁣
🥉 3rd Place, RM25 : LEGOLIN by Putri Irdina⁣⁣⁣⁣
⁣⁣⁣⁣
-----------------------------------------------------------⁣⁣
Additionally, the judges have chosen their favourites. ⁣⁣
Allow us to announce the recipients of:⁣⁣
⁣⁣⁣⁣
𝐉𝐔𝐃𝐆𝐄'𝐒 𝐂𝐇𝐎𝐈𝐂𝐄 𝐀𝐖𝐀𝐑𝐃𝐒⁣⁣⁣
🎨 Best Artwork: RORIK VHALIS by Qirana Qassandra⁣⁣⁣⁣
📜 Best Storyline: RORIK VHALIS by Qirana Qassandra⁣⁣⁣⁣
⁣⁣⁣⁣
-----------------------------------------------------------⁣⁣
Let's not forget, the community has voted for their favourites. ⁣⁣
Congratulations to the recipients of:⁣⁣
⁣⁣
𝐂𝐎𝐌𝐌𝐔𝐍𝐈𝐓𝐘 𝐂𝐇𝐎𝐈𝐂𝐄 𝐀𝐖𝐀𝐑𝐃𝐒⁣⁣⁣
🎨 Best Artwork: RORIK VHALIS by Qirana Qassandra⁣⁣⁣⁣
📜 Best Storyline: LEGOLIN by Putri Irdina⁣⁣
⁣⁣
-----------------------------------------------------------⁣⁣
⁣⁣
Thank to all participants and our wonderful community, we hope to see you again next year.⁣⁣
For monetary prize winners, a committee member will be in touch with you shortly.",936,750,https://instagram.fagc3-1.fna.fbcdn.net/v/t51.2885-15/491444113_18074696932890946_981647721011173700_n.jpg?stp=dst-jpg_e15_tt6&_nc_ht=instagram.fagc3-1.fna.fbcdn.net&_nc_cat=110&_nc_oc=Q6cZ2QHWDDsaVXdCCeZZ5UC2wMZ-DLMuG_7t_ohrsuVhr_TnqCzOd6ElNr45-tlEokMfLFRm1JCBRXMAi_-iJPoUaS2l&_nc_ohc=3IOGnJKaEH0Q7kNvwHsWJTd&_nc_gid=Xh7iz7esbnqQcFEUHlqE_g&edm=APs17CUBAAAA&ccb=7-5&oh=00_AfJBCrwGeIbFRwEO9LiWrQtW8yXHsx3SCfVMiVRWA3sAbQ&oe=682767E1&_nc_sid=10d13b,,,Dive Into Imagination for Creative Entertainment,mmu.dice,2025-04-24T06:27:45.000Z
"Photo by Dive Into Imagination for Creative Entertainment on May 01, 2025. May be an image of ‎poster and ‎text that says '‎WINNER ANNOUNCEMENT 2 داعما ら日 ห- y 定印 IPFNEN QIRANA NUR NURIMAN IMAN LEGOLIN 3 PUTRI FORGEME FORGE ME‎'‎‎.","Ready to grow your skills and make an impact?
Join the MMU Smart Farming Program (MUST) 2025 Committee and be part of an innovative team shaping the future of smart agriculture!

We’re recruiting for:
•	Hardware & Design Implementation
•	Software Development
•	Communications & Publicity
•	Secretarial Department

Why join?
✨ Real-world tech exposure
🛠️ Hands-on skills (hardware, software & IoT!)
🤝 Leadership & teamwork experience
🌐 Mentorship & industry networking
📁 Portfolio & career boost#
Deadline: 17 March 2025
Scan the QR code and join now!

Let’s build the future—together.
#engsocmmu",1080,1080,https://scontent-iad3-1.cdninstagram.com/v/t51.2885-15/495366434_18075390493890946_6611081210155238749_n.jpg?stp=dst-jpg_e15_fr_s1080x1080_tt6&_nc_ht=scontent-iad3-1.cdninstagram.com&_nc_cat=110&_nc_oc=Q6cZ2QGgeFFpmq2Fa8hm44UCDgFo7HNCOnVf3vkNDrWjb_pdI7VGxyqkJmAhvqgHCZlnDFs&_nc_ohc=Me4_tKEHuMYQ7kNvwFuCwC2&_nc_gid=y0FwT8j1BTXn3UzB70mM0Q&edm=APs17CUBAAAA&ccb=7-5&oh=00_AfIYK7WdUs1Jt9iresJMpYj4pkHYVs_9vKS5q7esFe_Gfg&oe=68275C87&_nc_sid=10d13b,,,Dive Into Imagination for Creative Entertainment,mmu.dice,2025-05-02T01:54:36.000Z
